{
  "version": 3,
  "review": {
    "title": "Project review",
    "subtitle": "Monthly review",
    "reviewDate": "2026-09-03",
    "previousReviewDate": "2026-07-02"
  },
  "settings": {
    "language": "en",
    "identity": {
      "org": "Projay Inc.",
      "unit": "IT",
      "orgLong": "Projay Inc.",
      "unitLong": "Information Technology Department",
      "contact": "it@projay.example",
      "logo": "data:image/svg+xml;base64,PHN2ZyB4bWxucz0iaHR0cDovL3d3dy53My5vcmcvMjAwMC9zdmciIHdpZHRoPSI1MTIiIGhlaWdodD0iNTEyIiB2aWV3Qm94PSIwIDAgNTEyIDUxMiIgcm9sZT0iaW1nIiBhcmlhLWxhYmVsbGVkYnk9InRpdGxlIj4KPHRpdGxlIGlkPSJ0aXRsZSI+UHJvamF5IOKAlCBnZWFpLCBjbGFpcjwvdGl0bGU+CjxyZWN0IHg9IjEiIHk9IjEiIHdpZHRoPSI1MTAiIGhlaWdodD0iNTEwIiByeD0iMTExIiBmaWxsPSIjZWVmMmZmIiBzdHJva2U9IiNlMGU3ZmYiIHN0cm9rZS13aWR0aD0iMiIvPgo8ZyB0cmFuc2Zvcm09InRyYW5zbGF0ZSgtMTEgLTEwNykgc2NhbGUoLjc2KSI+PHBhdGggZmlsbD0iIzMxMmU4MSIgZD0iTTE5MCA1NjcgMzI2IDU1MiAxNzggNjk5UTEzOSA3MTcgODkgNzA4UTcyIDcwNSA4NCA2OTRaIi8+PHBhdGggZmlsbD0iIzMxMmU4MSIgZD0iTTMzMSA2MTAgMzU2IDYxMiAzOTEgNjc0UTQxOCA2NzggNDM1IDcwMFEzOTIgNjg5IDM0MSA2OTdRMzQ0IDY4NyAzNzYgNjg0WiBNMzg5IDYwNyA0MTYgNjEyIDQ0MiA2NzVRNDgyIDY3OCA1MDEgNjk4UTQ2NCA2ODkgNDM4IDY5M0w0MTQgNjgzWiIvPjxwYXRoIGZpbGw9IiNmZmYxZGYiIGQ9Ik01MjAgMzA3UTU2NSAzMDcgNTY1IDMzOFE1NDYgMzc1IDUzOCA0MzFRNTM1IDQ3NyA1MDUgNTI2UTQzOCA2NDAgMjQ4IDYyNEwyMDEgNjEyIDI3NCA1NDhaIi8+PHBhdGggZmlsbD0iI2JjODg2NyIgZD0iTTIwNCA1NThRMjY2IDQ2MiAzNDkgNDA1UTM4MiAzNzcgNDEwIDMyMkwzOTUgMzI2UTQyNSAyNTggNDkxIDI1N1E1NDQgMjU2IDU2NSAzMDZMNTQ5IDM0N1E1MTQgMzY1IDUxMyA0MDlRNTM4IDQ2OCA1MDAgNTE3UTQzNSA1OTUgMzIwIDYwMVEyNTkgNjAxIDIyMCA1ODRaIi8+PHBhdGggZmlsbD0iI2ZmZjFkZiIgZD0iTTQ0OCAzMDBRNTAyIDI2NCA1NDQgMjkyUTU1NyAzMDMgNTY1IDMxNkw1NTEgMzUyUTUxNyAzNTMgNDk2IDM3N0w0NDkgMzUxUTQ1MyAzMjcgNDg2IDMxNFE0ODQgMzAxIDQ0OCAzMDBaIi8+PHBhdGggZmlsbD0iIzFiMWIzNSIgZD0iTTQ4NiAzNTVRNTE0IDMzNyA1NTMgMzMwTDU1MCAzNTBRNTIzIDM1OSA1MTggMzk3TDQ4MSAzNzFaIi8+PHBhdGggZmlsbD0iIzMxMmU4MSIgZD0iTTU2MiAzMDRRNjAwIDMxMCA2MjcgMzMwUTU5MyAzNDYgNTYxIDM0N1E1NTAgMzQ2IDU1MyAzMzZaIi8+PGNsaXBQYXRoIGlkPSJ3aW5nLWNsaXAiPjxwYXRoIGQ9Ik0xODUgNTc5UTI1OCA0ODQgMzQwIDQzMVEzOTggNDAyIDQ0MyA0MTRRNDc1IDQyMSA0NjIgNDU0UTQzNSA1MjcgMzMwIDU1MFoiLz48L2NsaXBQYXRoPjxwYXRoIGZpbGw9IiM2MzY2ZjEiIGQ9Ik0xODUgNTc5UTI1OCA0ODQgMzQwIDQzMVEzOTggNDAyIDQ0MyA0MTRRNDc1IDQyMSA0NjIgNDU0UTQzNSA1MjcgMzMwIDU1MFoiLz48ZyBjbGlwLXBhdGg9InVybCgjd2luZy1jbGlwKSI+PHBhdGggZmlsbD0iIzMxMmU4MSIgZD0iTTI5MiA0NTUgMzEyIDQ0MFEzNDUgNDk0IDQxNiA1MTRMMzkyIDUzMFEzMjYgNTExIDI5MiA0NTVaIE0yNTMgNDgxIDI3MyA0NjRRMzA0IDUxNiAzNjkgNTM5TDM0MyA1NTBRMjgyIDUyNiAyNTMgNDgxWiIvPjwvZz48Y2lyY2xlIGZpbGw9IiMxYjFiMzUiIGN4PSI1MTYiIGN5PSIzMTMiIHI9IjE4Ii8+PGNpcmNsZSBmaWxsPSIjZmZmMWRmIiBjeD0iNTIxIiBjeT0iMzA3IiByPSI1Ii8+PC9nPgo8L3N2Zz4="
    },
    "theme": {
      "style": "flat",
      "palette": "material",
      "font": "Roboto"
    },
    "show": {
      "healthDashboard": true,
      "recap": true,
      "archives": true,
      "decisions": true
    },
    "recapRows": 11
  },
  "categories": [
    {
      "id": "poste",
      "name": "Workplace",
      "color": "indigo"
    },
    {
      "id": "infra",
      "name": "Infrastructure",
      "color": "teal"
    },
    {
      "id": "services",
      "name": "Services",
      "color": "blue"
    },
    {
      "id": "telephonie",
      "name": "Telephony",
      "color": "purple"
    },
    {
      "id": "applications",
      "name": "Applications",
      "color": "orange"
    },
    {
      "id": "ssi",
      "name": "Security",
      "color": "red"
    },
    {
      "id": "ia",
      "name": "AI & data",
      "color": "green"
    },
    {
      "id": "organisation",
      "name": "Organisation & processes",
      "color": "brown"
    }
  ],
  "projects": [
    {
      "id": "P-01",
      "name": "Graphics workstation refresh",
      "categoryId": "poste",
      "priority": "P2",
      "stage": "inProgress",
      "onHold": false,
      "health": "onTrack",
      "progress": 60,
      "lead": "M. OKONKWO",
      "sponsor": "Management",
      "scope": "Head office + Bordeaux studio — 38 workstations",
      "goal": "Replace the creative teams' graphics workstations without disrupting production, while reducing the number of configurations to maintain.",
      "budget": "Manufacturer framework contract — 38 machines",
      "start": "2026-03-15",
      "targetEnd": "2027-01-15",
      "done": [
        "Inventory of the existing fleet",
        "Definition of the three standard configurations",
        "Orders placed — 07/26"
      ],
      "ongoing": ["**Pilot team** installation — animation floor, head office"],
      "next": ["Floor-by-floor rollout — 6 waves", "Collection of the old workstations"],
      "risks": "Manufacturer delivery delays observed on the first order.",
      "decisions": [
        {
          "question": "Switch the mobile teams' workstations to leasing?",
          "decider": "Management",
          "taken": {
            "text": "Approved — leasing for the 3 mobile teams",
            "when": "2026-07-02"
          }
        }
      ],
      "milestones": [
        {
          "label": "Requirements statement",
          "date": "2026-03-15",
          "done": true
        },
        {
          "label": "Orders",
          "date": "2026-07-01",
          "done": true
        },
        {
          "label": "Pilot team",
          "date": "2026-09-20",
          "done": false
        },
        {
          "label": "Rollout complete",
          "date": "2027-01-15",
          "done": false
        }
      ],
      "sheet": "auto",
      "updatedOn": "2026-09-01",
      "author": "M. OKONKWO"
    },
    {
      "id": "P-02",
      "name": "Unified endpoint management (MDM) — wave 2",
      "categoryId": "poste",
      "priority": "P1",
      "stage": "inProgress",
      "onHold": false,
      "health": "watch",
      "progress": 45,
      "lead": "S. LINDQVIST",
      "scope": "210 remaining devices (Mac and PC, Bordeaux included)",
      "goal": "Enrol every device into unified management before the year-end audit, without losing any production tool.",
      "budget": "n/a",
      "start": "2026-01-12",
      "targetEnd": "2026-12-18",
      "done": [
        "Wave 1 closed — 180 devices",
        "Qualification of application baseline v2",
        "Order placed for the 30 early-refresh devices",
        "Communication to team leads — floor-by-floor schedule"
      ],
      "ongoing": [
        "Enrolment of the support teams — 40 devices",
        "Testing the \"QA\" standard build with dual screens"
      ],
      "next": [
        "Bordeaux studio wave — from 10/26",
        "Handling of the 12 devices with an incompatible graphics tablet",
        "End-of-rollout review — 01/27"
      ],
      "risks": "Graphics tablet driver incompatible with the MDM agent on 12 devices; vendor fix expected.",
      "decisions": [],
      "milestones": [
        {
          "label": "Wave 1",
          "date": "2026-05-30",
          "done": true
        },
        {
          "label": "Wave 2",
          "date": "2026-10-16",
          "done": false
        },
        {
          "label": "Bordeaux studio",
          "date": "2026-12-18",
          "done": false
        }
      ],
      "sheet": "auto",
      "updatedOn": "2026-08-28",
      "author": "S. LINDQVIST"
    },
    {
      "id": "P-03",
      "name": "Hybrid meeting rooms",
      "categoryId": "poste",
      "stage": "residuals",
      "onHold": false,
      "health": "onTrack",
      "progress": 100,
      "lead": "A. FERREIRA",
      "scope": "3 rooms equipped",
      "goal": "Equip three meeting rooms for video conferencing and simplify room booking.",
      "budget": "Remainder of the 2025 hardware budget",
      "start": "2025-10-01",
      "targetEnd": "2026-01-30",
      "actualEnd": "2026-02-23",
      "done": [
        "3 rooms equipped — screens + video bars",
        "Booking integrated with the calendar",
        "User guide displayed in each room"
      ],
      "ongoing": ["Acoustic rework — Mirage room"],
      "next": ["6-month usage review — 12/26"],
      "decisions": [],
      "milestones": [
        {
          "label": "Technical rollout",
          "date": "2025-12-15",
          "done": true
        },
        {
          "label": "Go-live",
          "date": "2026-02-23",
          "done": true
        },
        {
          "label": "6-month review",
          "date": "2026-12-10",
          "done": false
        }
      ],
      "sheet": "auto",
      "updatedOn": "2026-08-30",
      "author": "A. FERREIRA"
    },
    {
      "id": "P-04",
      "name": "Off-site backup of the software forge",
      "categoryId": "infra",
      "priority": "P1",
      "stage": "inProgress",
      "onHold": false,
      "health": "alert",
      "progress": 35,
      "lead": "R. KOVAČ",
      "sponsor": "CISO",
      "scope": "Forge — repositories, build artifacts, 46 VMs",
      "goal": "Move the software forge backup off-site and prove full restoration through an annual test.",
      "budget": "Dedicated array — extension to be arbitrated",
      "start": "2026-05-08",
      "targetEnd": "2026-12-01",
      "done": ["Scoping and sizing", "Proof of concept validated on 4 VMs — 08/26"],
      "ongoing": ["Preparation of the 1st batch cutover — 15 VMs"],
      "next": ["1st batch cutover — 10/26", "**Full restoration test** — 12/26"],
      "risks": "Nightly backup window too short; overnight builds might not be covered.",
      "decisions": [
        {
          "question": "Arbitrate the array extension (€18k) to meet the 30-day retention target?",
          "decider": "Management"
        }
      ],
      "milestones": [
        {
          "label": "Scoping",
          "date": "2026-05-08",
          "done": true
        },
        {
          "label": "Proof of concept",
          "date": "2026-08-10",
          "done": true
        },
        {
          "label": "1st batch cutover",
          "date": "2026-10-05",
          "done": false
        },
        {